{"$schema":"https://ui.logic2b.com/schema/registry-changelog.json","schemaVersion":1,"name":"mail-client-01","currentVersion":"1.0.0-rc.10","changes":[{"version":"1.0.0-rc.10","releasedAt":"2026-08-30","kind":"added","summary":"Add a responsive three-pane mail client with folder navigation, search, message selection, unread and label states, a reading view and interactive starring."},{"version":"1.0.0-rc.1","releasedAt":"2026-08-29","kind":"baseline","summary":"First release tracked by the immutable registry manifest and per-item changelog contract."}]}