{"$schema":"https://ui.logic2b.com/schema/registry-changelog.json","schemaVersion":1,"name":"admin-customers-01","currentVersion":"1.0.0-rc.17","changes":[{"version":"1.0.0-rc.17","releasedAt":"2026-10-03","kind":"changed","summary":"Expose controlled customer data/actions and loading, empty/search, recovery and permission states with a versioned behavior contract."},{"version":"1.0.0-rc.1","releasedAt":"2026-08-29","kind":"baseline","summary":"First release tracked by the immutable registry manifest and per-item changelog contract."}]}