{"$schema":"https://ui.logic2b.com/schema/registry-changelog.json","schemaVersion":1,"name":"table","currentVersion":"1.0.0-rc.18","changes":[{"version":"1.0.0-rc.18","releasedAt":"2026-09-18","kind":"fixed","summary":"Keep customer names visible at narrow widths and increased text size with an internally scrolling table; expose optional table-container props for named keyboard-focusable scroll regions."},{"version":"1.0.0-rc.8","releasedAt":"2026-08-29","kind":"changed","summary":"Add a source-generated API contract covering every public component, hook, type, utility, owned prop, default and inherited props expression."},{"version":"1.0.0-rc.2","releasedAt":"2026-08-29","kind":"changed","summary":"Add a machine-readable accessibility contract covering built-in semantics, keyboard behavior, consumer responsibilities and known limitations."},{"version":"1.0.0-rc.1","releasedAt":"2026-08-29","kind":"baseline","summary":"First release tracked by the immutable registry manifest and per-item changelog contract."}]}