{"$schema":"https://ui.logic2b.com/schema/registry-changelog.json","schemaVersion":1,"name":"command","currentVersion":"1.0.0-rc.8","changes":[{"version":"1.0.0-rc.8","releasedAt":"2026-08-29","kind":"changed","summary":"Add a source-generated API contract covering every public component, hook, type, utility, owned prop, default and inherited props expression."},{"version":"1.0.0-rc.6","releasedAt":"2026-08-29","kind":"fixed","summary":"Expose command separators as aria-hidden decoration so listbox child semantics remain valid without affecting cmdk behavior."},{"version":"1.0.0-rc.5","releasedAt":"2026-08-29","kind":"fixed","summary":"Keep decorative separators out of list semantics, make item groups semantically neutral by default, and prevent implicit panel scroll regions while retaining explicit consumer overflow control."},{"version":"1.0.0-rc.2","releasedAt":"2026-08-29","kind":"changed","summary":"Add a machine-readable accessibility contract covering built-in semantics, keyboard behavior, consumer responsibilities and known limitations."},{"version":"1.0.0-rc.1","releasedAt":"2026-08-29","kind":"baseline","summary":"First release tracked by the immutable registry manifest and per-item changelog contract."}]}