{"$schema":"https://ui.logic2b.com/schema/registry-changelog.json","schemaVersion":1,"name":"chart-realtime-01","currentVersion":"1.0.0-rc.16","changes":[{"version":"1.0.0-rc.16","releasedAt":"2026-08-30","kind":"fixed","summary":"Use an explicit wrapping flex header so controls align beside the title when space permits and wrap naturally on narrow screens regardless of base card display rules."},{"version":"1.0.0-rc.15","releasedAt":"2026-08-30","kind":"fixed","summary":"Align stream controls with the chart heading on desktop while preserving the stacked mobile header."},{"version":"1.0.0-rc.14","releasedAt":"2026-08-30","kind":"added","summary":"Add a deterministic rolling-window chart with start, pause and reset controls, live throughput and error metrics, accessible status announcements and animation-free updates."},{"version":"1.0.0-rc.1","releasedAt":"2026-08-29","kind":"baseline","summary":"First release tracked by the immutable registry manifest and per-item changelog contract."}]}