{"$schema":"https://ui.logic2b.com/schema/registry-changelog.json","schemaVersion":1,"name":"ai-chat-01","currentVersion":"1.0.0-rc.13","changes":[{"version":"1.0.0-rc.13","releasedAt":"2026-08-30","kind":"fixed","summary":"Capture each streaming chunk before scheduling React state updates so generation preserves the first token and never appends an undefined tail."},{"version":"1.0.0-rc.12","releasedAt":"2026-08-30","kind":"added","summary":"Add a responsive AI conversation workspace with accessible message history, deterministic streaming, stop and continue states, prompt composer and context rail."},{"version":"1.0.0-rc.1","releasedAt":"2026-08-29","kind":"baseline","summary":"First release tracked by the immutable registry manifest and per-item changelog contract."}]}